{
  "$schema": "https://json-schema.org/draft/2020-12/schema",
  "$id": "https://example.invalid/schemas/scenario.schema.json",
  "title": "Scenario",
  "type": "object",
  "additionalProperties": false,
  "required": [
    "schema_version",
    "scenario_id",
    "title",
    "summary",
    "status",
    "probability",
    "impact",
    "velocity",
    "lead_time",
    "reversibility",
    "first_order_variables",
    "trigger_conditions",
    "disconfirming_conditions",
    "updated_at",
    "sensitivity"
  ],
  "properties": {
    "schema_version": {
      "const": "0.1.0"
    },
    "scenario_id": {
      "type": "string",
      "pattern": "^scn-[A-Za-z0-9._-]+$"
    },
    "title": {
      "type": "string",
      "minLength": 1
    },
    "summary": {
      "type": "string",
      "minLength": 1
    },
    "status": {
      "enum": [
        "watch",
        "active",
        "escalating",
        "deescalating",
        "closed",
        "falsified"
      ]
    },
    "probability": {
      "type": "object",
      "additionalProperties": false,
      "required": [
        "low",
        "high",
        "basis"
      ],
      "properties": {
        "low": {
          "type": "number",
          "minimum": 0,
          "maximum": 1
        },
        "high": {
          "type": "number",
          "minimum": 0,
          "maximum": 1
        },
        "basis": {
          "type": "string",
          "minLength": 1
        }
      }
    },
    "impact": {
      "type": "integer",
      "minimum": 1,
      "maximum": 5
    },
    "velocity": {
      "enum": [
        "slow",
        "medium",
        "fast",
        "acute"
      ]
    },
    "lead_time": {
      "type": "object",
      "additionalProperties": false,
      "required": [
        "min_days",
        "max_days",
        "confidence"
      ],
      "properties": {
        "min_days": {
          "type": "number",
          "minimum": 0
        },
        "max_days": {
          "type": "number",
          "minimum": 0
        },
        "confidence": {
          "type": "number",
          "minimum": 0,
          "maximum": 1
        }
      }
    },
    "reversibility": {
      "enum": [
        "high",
        "medium",
        "low",
        "none"
      ]
    },
    "first_order_variables": {
      "type": "array",
      "minItems": 1,
      "uniqueItems": true,
      "items": {
        "enum": [
          "A",
          "B",
          "C",
          "D"
        ]
      }
    },
    "event_ids": {
      "type": "array",
      "uniqueItems": true,
      "items": {
        "type": "string",
        "pattern": "^evt-[A-Za-z0-9._-]+$"
      }
    },
    "edge_ids": {
      "type": "array",
      "uniqueItems": true,
      "items": {
        "type": "string",
        "pattern": "^edge-[A-Za-z0-9._-]+$"
      }
    },
    "evidence_ids": {
      "type": "array",
      "uniqueItems": true,
      "items": {
        "type": "string",
        "pattern": "^evd-[A-Za-z0-9._-]+$"
      }
    },
    "trigger_conditions": {
      "type": "array",
      "minItems": 1,
      "items": {
        "type": "string",
        "minLength": 1
      }
    },
    "disconfirming_conditions": {
      "type": "array",
      "minItems": 1,
      "items": {
        "type": "string",
        "minLength": 1
      }
    },
    "updated_at": {
      "type": "string",
      "format": "date-time"
    },
    "sensitivity": {
      "enum": [
        "public",
        "internal",
        "confidential",
        "restricted"
      ]
    }
  }
}
